kind,x,y,title,body
current,0.06,2.20,Worker-side (CPS),"Hours, transitions, NILF by AI tercile."
current,0.06,1.35,Business-side (BTOS),"BTOS AI use; supplement workforce shares."
current,0.06,0.50,Structure and macro,"Tasks, sector payroll; not worker-firm linked."
frontier,1.62,1.22,Missing integrated object,"No joint data: occ, firm AI, outcomes."
proposal,3.18,2.20,CPS: AI-at-work module,"Job AI module; modest quality claims."
proposal,3.18,1.35,BTOS plus ABS,"BTOS + ABS structure anchor."
proposal,3.18,0.50,JOLTS pilot,"Coarse occ demand; not full detail."
horizon,4.82,1.22,Linked administrative data,"Linkage for worker-firm integration."
